{
  "closure_id": "PHASE-7-CLOSURE",
  "closure_version": "0.1.0",
  "phase": "Phase 7 — UX, Evidence & Reporting Design",
  "work_package": "P7-WP7",
  "gate": "GATE-032",
  "baseline": "324fc320c47498a42f68c6bac941cc4a5dde9b39",
  "engine_version": "1.0.0",
  "lifecycle": {
    "state": "CLOSED",
    "status": "PHASE 7 CLOSED",
    "decision_vocabulary": [
      "APPROVE",
      "REQUEST_CHANGES"
    ],
    "review_history": [
      {
        "round": 1,
        "kind": "INITIAL_INDEPENDENT_REVIEW",
        "decision": "REQUEST_CHANGES",
        "counts": {
          "BLOCKER": 0,
          "HIGH": 0,
          "MEDIUM": 2,
          "LOW": 0,
          "INFO": 0
        },
        "reviewer_role": "Independent reviewer",
        "record_reference": "GATE-032 §7",
        "evidence_source": "User-supplied P7-WP7 Round 1 review and independently reproduced findings (2026-10-12)"
      },
      {
        "round": 2,
        "kind": "TARGETED_INDEPENDENT_REREVIEW",
        "decision": "APPROVE",
        "counts": {
          "BLOCKER": 0,
          "HIGH": 0,
          "MEDIUM": 0,
          "LOW": 0,
          "INFO": 0
        },
        "reviewer_role": "Independent reviewer",
        "record_reference": "GATE-032 §7",
        "evidence_source": "User-supplied P7-WP7 targeted Round 2 APPROVE; both findings independently closed (2026-10-12)"
      }
    ],
    "approval": {
      "round": 2,
      "decision": "APPROVE",
      "record_reference": "GATE-032 §7",
      "reviewer_role": "Independent reviewer"
    },
    "merge_evidence": {
      "repository": "nishanth-cryptos/TrustLens",
      "pr_number": 43,
      "pr_head_commit": "5af988d2740c4d826abc0f2e3074cd1fe3d28526",
      "merge_commit": "0a21d1f858eb7680e05ce703966201f06902e4c8",
      "base_commit": "324fc320c47498a42f68c6bac941cc4a5dde9b39",
      "remote_ci": {
        "workflow": "knowledge-validation",
        "checks": [
          "Knowledge validation suite",
          "Quality-gate self-test (gate must bite)"
        ],
        "conclusion": "success",
        "pr_head_run_id": 38266862243,
        "merge_commit_run_id": 38273120361
      },
      "verification": "READ_ONLY_GITHUB_VERIFICATION",
      "verification_reference": "GATE-032 §8"
    }
  },
  "scope": {
    "owned": [
      "Integrated Phase-7 closure"
    ],
    "excluded": [
      "Frontend, backend and API implementation (Phase 9)",
      "Implementation planning content of PLAN-001 (Phase 8)",
      "New API operations, persisted fields, permissions, supported languages or breakpoint values"
    ]
  },
  "work_packages": [
    {
      "work_package": "P7-WP1",
      "contract_id": "UX-001",
      "gate": "GATE-026",
      "effective_state": "MERGED_CI_VERIFIED",
      "contract_status": "P7-WP1 UX FOUNDATION APPROVED FOLLOWING INDEPENDENT REVIEW — REMOTE CI + MERGE PENDING",
      "final_review": "APPROVE",
      "record": "PHASE-7-CLOSURE §2",
      "pr_number": 34,
      "pr_head_commit": "1d99bcc88004d36115f2ea501cdde8755f2f87d5",
      "merge_commit": "d16ee7a8fd65a0428a0cde7cc1dceb7bd166d528",
      "base_commit": "bbe741b8ebfb7adbc399c1231b74f67f73ba2cfc",
      "pr_head_run_id": 37309265948,
      "merge_commit_run_id": 37309298428
    },
    {
      "work_package": "P7-WP2",
      "contract_id": "UX-002",
      "gate": "GATE-027",
      "effective_state": "CLOSED",
      "contract_status": "P7-WP2 SUBMISSION INTAKE CLOSED",
      "final_review": "APPROVE",
      "record": "GATE-027 §8",
      "pr_number": 35,
      "pr_head_commit": "8eb1e3f8743adfd4b20ac674a8b3d525461496f0",
      "merge_commit": "4567b9b0e7fc9be847ce0b1567ef6ef1ad77c51d",
      "base_commit": "d16ee7a8fd65a0428a0cde7cc1dceb7bd166d528",
      "pr_head_run_id": 37932022803,
      "merge_commit_run_id": 37934882890
    },
    {
      "work_package": "P7-WP3",
      "contract_id": "UX-003",
      "gate": "GATE-028",
      "effective_state": "CLOSED",
      "contract_status": "P7-WP3 RESULT PRESENTATION CLOSED",
      "final_review": "APPROVE",
      "record": "GATE-028 §8",
      "pr_number": 37,
      "pr_head_commit": "b4c457257f4b7880d30f35fc98350d745e59ffa2",
      "merge_commit": "8d9b71a3d9fbd864d7b373e3bd4c541348a44349",
      "base_commit": "47f57d1d8f2b9f2ddedb2b438bc40ac3f32e4a70",
      "pr_head_run_id": 38116825962,
      "merge_commit_run_id": 38118409062
    },
    {
      "work_package": "P7-WP4",
      "contract_id": "UX-004",
      "gate": "GATE-029",
      "effective_state": "CLOSED",
      "contract_status": "P7-WP4 EVIDENCE REVIEW AND SECURITY UX CLOSED",
      "final_review": "APPROVE",
      "record": "GATE-029 §8",
      "pr_number": 39,
      "pr_head_commit": "cf4ca8d37388f0f1a7e132a716e4cb776d0b38bc",
      "merge_commit": "5f8c373d63cbf0544ddccf414020659b9fd3330a",
      "base_commit": "e58dac6bff63a8cb79512338919af6d15db958c1",
      "pr_head_run_id": 38139502369,
      "merge_commit_run_id": 38142036162
    },
    {
      "work_package": "P7-WP5",
      "contract_id": "UX-005",
      "gate": "GATE-030",
      "effective_state": "CLOSED",
      "contract_status": "P7-WP5 REPORTING AND HISTORICAL WORKFLOWS UX CLOSED",
      "final_review": "APPROVE",
      "record": "GATE-030 §8",
      "pr_number": 41,
      "pr_head_commit": "16500fe3c05b067241f1d7d300abc0f8a4aaac37",
      "merge_commit": "7f3c2899dae693d3b497faa3a68f691890488d2d",
      "base_commit": "b5a663a6dd6343b17b7cf8dfa927c0aae4f8ebd9",
      "pr_head_run_id": 38161387705,
      "merge_commit_run_id": 38163633985
    },
    {
      "work_package": "P7-WP6",
      "contract_id": "UX-006",
      "gate": "GATE-031",
      "effective_state": "CLOSED",
      "contract_status": "P7-WP6 ACCESSIBILITY, RESPONSIVE AND ENRICHMENT UX CLOSED",
      "final_review": "APPROVE",
      "record": "GATE-031 §8",
      "pr_number": 42,
      "pr_head_commit": "b5dd2c776f17564d01f45ae6c65cef060d560761",
      "merge_commit": "324fc320c47498a42f68c6bac941cc4a5dde9b39",
      "base_commit": "7f3c2899dae693d3b497faa3a68f691890488d2d",
      "pr_head_run_id": 38238792863,
      "merge_commit_run_id": 38244422412
    }
  ],
  "snapshot": [
    {
      "contract_id": "UX-001",
      "path": "contracts/ux/ux-foundation-v1.json",
      "sha256": "2a1a058028f4cf50597dc787aa4f18fa0f8364752818474ccb9cfa5a43aa7430"
    },
    {
      "contract_id": "UX-001",
      "path": "contracts/ux/ux-foundation-contract.schema.json",
      "sha256": "e63ab8621e5ebfe4bc44e8d9e3aa5a03ce49789d42b2884778cc6e2180c815cc"
    },
    {
      "contract_id": "UX-001",
      "path": "contracts/ux/fixtures/negative-mutations.json",
      "sha256": "e5d42964c68978661d454fbe4d99fa493f759033ddd126bd6727d9cf849cb312"
    },
    {
      "contract_id": "UX-001",
      "path": "docs/07-ux/UX-001-experience-foundation-information-architecture.md",
      "sha256": "622f1a1a59dd5658e3f6555d164437d0b01c7c84bf3a5f8bbe0d2c5728b750aa"
    },
    {
      "contract_id": "UX-001",
      "path": "docs/00-program/GATE-026-phase-7-ux-foundation.md",
      "sha256": "09da5cabc0252c75f60ede0f16afc801ef044de3dc719aab028b89c418201f9b"
    },
    {
      "contract_id": "UX-001",
      "path": "knowledge/validation/validate_ux_foundation.py",
      "sha256": "cbcf16fcfd6a8709cb3e113994414a41ed159ca75be3495cfa7b574c6c0e72e6"
    },
    {
      "contract_id": "UX-002",
      "path": "contracts/ux/ux-intake-v1.json",
      "sha256": "be4a2933a1153549233813e4bf16a349aff578f66f29dd7db58425241706a83a"
    },
    {
      "contract_id": "UX-002",
      "path": "contracts/ux/ux-intake-contract.schema.json",
      "sha256": "fd619a70d2db6fb0245bd7e38277f8aa695ad3d490aa682e7a5905d2f7d0e83c"
    },
    {
      "contract_id": "UX-002",
      "path": "contracts/ux/fixtures/intake-negative-mutations.json",
      "sha256": "73293799621d664aa0f533fde98d70f1dbf4de71d4eb76c883b916a5ab7e7ed1"
    },
    {
      "contract_id": "UX-002",
      "path": "docs/07-ux/UX-002-submission-evidence-intake.md",
      "sha256": "6db2f57750593c9dd9e757fcf6e3c9a261d056bfdc3ff52a4fbdd14e74443453"
    },
    {
      "contract_id": "UX-002",
      "path": "docs/00-program/GATE-027-phase-7-submission-intake.md",
      "sha256": "dbbc171c032582c5fcea5c32fd7101d727b556e64e5813fe94e3ace031e4e8d9"
    },
    {
      "contract_id": "UX-002",
      "path": "knowledge/validation/validate_ux_intake.py",
      "sha256": "b8f31c83ab207ea2962562d34dc35ab584abfa7a5cc68516b4f45d629a923bcf"
    },
    {
      "contract_id": "UX-003",
      "path": "contracts/ux/ux-result-v1.json",
      "sha256": "c8f63807165bbd1983f31d459d1281e46b77ff917ffd728c5cec034435951862"
    },
    {
      "contract_id": "UX-003",
      "path": "contracts/ux/ux-result-contract.schema.json",
      "sha256": "16110a5b735770720f3dd6f6e4b36bafd2cc21d36f74772e347c76203bde5e7b"
    },
    {
      "contract_id": "UX-003",
      "path": "contracts/ux/fixtures/result-negative-mutations.json",
      "sha256": "a8da40826295a4f3cd60bdbd60ed33aeb2adac7a7468715d2af44e9c943d7f63"
    },
    {
      "contract_id": "UX-003",
      "path": "docs/07-ux/UX-003-result-presentation.md",
      "sha256": "c1fc84afbffae3e31e14b2f41b8373e62c5afa6e14eb2954313acfd86c39e9df"
    },
    {
      "contract_id": "UX-003",
      "path": "docs/00-program/GATE-028-phase-7-result-presentation.md",
      "sha256": "93390e644935a6383dc366603c9fd0f99ac3309e38aa7adc3fac448897a6310d"
    },
    {
      "contract_id": "UX-003",
      "path": "knowledge/validation/validate_ux_result.py",
      "sha256": "4bc3fd5496763bbaf1b65bc02b7425ad75a0b3116c0cc99c5cb2b3639f2f998d"
    },
    {
      "contract_id": "UX-004",
      "path": "contracts/ux/ux-review-v1.json",
      "sha256": "86e029b42144191cfbaff536c74c4db5cc8ae173d38e2bd9eedf9692b3e8421a"
    },
    {
      "contract_id": "UX-004",
      "path": "contracts/ux/ux-review-contract.schema.json",
      "sha256": "b44d612dc1cea5d054adb9cfcb857b9518d93241e82e007dd19c2acfee16ff83"
    },
    {
      "contract_id": "UX-004",